{
  "$schema": "https://json-schema.org/draft/2020-12/schema",
  "$id": "kolmaf-provider/v1",
  "title": "Kolmaf provider adapter manifest",
  "description": "Durable configuration for one installed KoLmafia plugin. Runtime observations (installed, target exists, last observed, error) belong in generated registry output, never here.",
  "type": "object",
  "required": [
    "schema",
    "id",
    "name",
    "uri",
    "authority",
    "targets",
    "relationships"
  ],
  "properties": {
    "schema": {
      "const": "kolmaf-provider/v1"
    },
    "id": {
      "type": "string",
      "pattern": "^[a-z0-9][a-z0-9\\-_]*$"
    },
    "name": {
      "type": "string",
      "minLength": 1
    },
    "uri": {
      "type": "string",
      "pattern": "^kolmaf://[a-z0-9][a-z0-9\\-_]*(/[a-z0-9][a-z0-9\\-_.]+)+$"
    },
    "description": {
      "type": "string"
    },
    "authority": {
      "type": "string",
      "enum": [
        "NAVIGATION_ONLY",
        "REFERENCE_ONLY",
        "GUIDANCE_ONLY",
        "OBSERVATION_ONLY",
        "TEST_ONLY",
        "LOCAL_DOCUMENT_WRITE",
        "GOVERNED_MUTATION",
        "STRUCTURAL_DENY"
      ]
    },
    "freshness": {
      "type": "string",
      "enum": [
        "STATIC",
        "VERSIONED",
        "SESSION",
        "LIVE",
        "DERIVED",
        "HISTORICAL"
      ]
    },
    "capabilities": {
      "type": "array",
      "items": {
        "type": "string",
        "minLength": 1
      }
    },
    "human": {
      "type": "object"
    },
    "agent": {
      "type": "object"
    },
    "targets": {
      "type": "array",
      "minItems": 1,
      "items": {
        "type": "object",
        "required": ["uri", "path", "required"],
        "properties": {
          "uri": {
            "type": "string",
            "pattern": "^kolmaf://[a-z0-9][a-z0-9\\-_]*(/[a-z0-9][a-z0-9\\-_.]+)+$"
          },
          "path": {
            "type": "string",
            "minLength": 1
          },
          "required": {
            "type": "boolean"
          },
          "kind": {
            "type": "string",
            "enum": ["file", "dir"]
          },
          "note": {
            "type": "string"
          }
        }
      }
    },
    "relationships": {
      "type": "array",
      "items": {
        "type": "object",
        "required": ["type", "target"],
        "properties": {
          "type": {
            "type": "string",
            "enum": [
              "DOCUMENTS",
              "PROVIDES",
              "IMPLEMENTS",
              "DEPENDS_ON",
              "REFERENCES",
              "RELATED_TO",
              "TESTED_BY",
              "CAN_VERIFY",
              "CAN_RENDER",
              "GENERATED_FROM",
              "OBSERVED_FROM"
            ]
          },
          "target": {
            "type": "string",
            "pattern": "^kolmaf://[a-z0-9][a-z0-9\\-_]*(/[a-z0-9][a-z0-9\\-_.]+)+$"
          },
          "note": {
            "type": "string"
          }
        }
      }
    },
    "provenance": {
      "type": "object",
      "properties": {
        "evidence": {
          "type": "string"
        },
        "note": {
          "type": "string"
        }
      }
    }
  }
}
