{
  "schema": "kolmaf-provider/v1",
  "id": "tokens-of-loathing",
  "name": "Tokens of Loathing",
  "uri": "kolmaf://provider/tokens",
  "description": "Typed versioned Kingdom of Loathing game data as queryable SQLite. Reference only; freshness VERSIONED.",
  "authority": "REFERENCE_ONLY",
  "freshness": "VERSIONED",
  "capabilities": ["typed-game-data", "sqlite-reference", "item-identity"],
  "human": {
    "entry": "packages/client",
    "note": "typed TypeScript client over hosted or local SQLite"
  },
  "agent": {
    "database": "~/.kolmafia/data/dol.sqlite",
    "compat": "~/Downloads/tokens-of-loathing-compat"
  },
  "targets": [
    {
      "uri": "kolmaf://tokens/database/current",
      "path": "$HOME/.kolmafia/data/dol.sqlite",
      "required": true,
      "kind": "file",
      "note": "PROVEN local SQLite; 12007 items; id 153 Ancient Saucehelm"
    },
    {
      "uri": "kolmaf://tokens/item/153",
      "path": "$HOME/.kolmafia/data/dol.sqlite",
      "required": true,
      "kind": "file",
      "note": "row verified SELECT id,name FROM items WHERE id=153"
    },
    {
      "uri": "kolmaf://tokens/compat-checkout",
      "path": "$HOME/Downloads/tokens-of-loathing-compat",
      "required": false,
      "kind": "dir",
      "note": "data-of-loathing compat checkout; brittle user path, optional"
    },
    {
      "uri": "kolmaf://tokens/source",
      "path": "$HOME/.kolmafia/git/data-of-loathing-repo",
      "required": false,
      "kind": "dir",
      "note": "source checkout; provenance only"
    }
  ],
  "relationships": [
    {
      "type": "TESTED_BY",
      "target": "kolmaf://provider/sandbox",
      "note": "sandbox contract mock verification provider is tokens-compat"
    }
  ],
  "provenance": {
    "evidence": "PROVEN_LOCAL_DB__UPSTREAM_INFERRED",
    "note": "Slice-1 distinction preserved: local dol.sqlite PROVEN; canonical upstream donCannoli-burns/tokens-of-loathing@5ff383e INFERRED from sandbox contract, not silently upgraded"
  }
}
